{
  "as_of": "2026-09-05",
  "candidate_id": "SYNERGY_REPOSITORY_FEDERATION_V3_CANDIDATE_20260905",
  "candidate_status": "AUDITED_SCOPE_EXPANSION_PENDING_HUMAN_REVIEW",
  "canonical_promotion": false,
  "combined_repository_names": [
    "Shtenco/shtenco.github.io",
    "Shtenco/quantum-trading_metatrader5",
    "Shtenco/computer_vision_trading_metatrader_5",
    "Shtenco/swap_arbitrage_metatrader_5",
    "Shtenco/cross_forex_arbitrage_trading_metatrader_5",
    "Shtenco/global_liquidity_dataminer",
    "Shtenco/3D_bars_market_structure",
    "Shtenco/multi_threaded_trading_robot_with_machine_learning_python",
    "Shtenco/midas_ai_trading_system",
    "Shtenco/midas_lite",
    "Shtenco/turbo_linux",
    "Shtenco/agi_olga",
    "Shtenco/ai_coder",
    "Shtenco/ai_trade_terminal",
    "Shtenco/shtencoauantai.github.io",
    "Shtenco/cashero",
    "Shtenco/ai_language",
    "Shtenco/sinergy-super-app",
    "Shtenco/binary_quantum_theory",
    "Shtenco/ai_financial_system",
    "Shtenco/algotrading_graph_system",
    "Shtenco/ai_compress",
    "Shtenco/synergy_pay_system",
    "Shtenco/synergy_ai_blockchain",
    "Shtenco/synergychain",
    "Shtenco/synergychain.github.io",
    "Shtenco/cold_nuclear",
    "Shtenco/usds",
    "Shtenco/synergy_financial_os",
    "Shtenco/synergy_eurasian",
    "Shtenco/synergy_matrix_sota",
    "Shtenco/agi_nexus",
    "Shtenco/midas_ai",
    "Shtenco/synergy_system",
    "Shtenco/nexus_science_agent",
    "Shtenco/synergynet",
    "Shtenco/synergy_meta_os",
    "Shtenco/blochain_budget",
    "Shtenco/agi_autopilot",
    "Shtenco/sinergy_app",
    "Shtenco/synergy_app",
    "Shtenco/qr_compress",
    "Shtenco/synergy_metachain",
    "Shtenco/motherboard_xpu_xml",
    "Shtenco/print_money_synergychain"
  ],
  "evidence_audit": {
    "audit_digest": "450d50d0c746e8c36cd0e5e5036f9aece1b9b48e1bfcbe79052a827f8283172f",
    "audit_id": "SYNERGY_REPOSITORY_EVIDENCE_AUDIT_V1_20260905"
  },
  "federation_candidate_digest": "ded2c2482b0c74a79886cec5ffaf9d37b0392f5a1bc8faa325a94ca516a36022",
  "owner": "Shtenco",
  "parent": {
    "federation_digest": "7de7c2dda23db2581294176bb262ae4aa8cbdc4ba97cdd4326278e88a9713a05",
    "membership_inherited": true,
    "repository_count": 42,
    "schema": "synergy.repository-federation/v2"
  },
  "policy": {
    "ai_accounting_authority": "NONE",
    "ai_blockchain_submission_authority": "NONE",
    "ai_financial_authority": "NONE",
    "ai_payment_authority": "NONE",
    "ai_production_deployment_authority": "NONE",
    "auto_merge": false,
    "historical_evidence_preserved": true,
    "internal_mint_or_revaluation_is_external_profit": false,
    "merge_authority": "HUMAN_MAINTAINER_ONLY",
    "status_promotion_requires_executed_evidence": true
  },
  "post_v2_additions": [
    {
      "authority": "RESEARCH_ONLY",
      "classification": "ACTIVE_R&D_TARGET",
      "maturity": "README_ONLY_BOOTSTRAP",
      "next_milestone": "Materialize source, protocol tests and explicit PQ interoperability evidence before any trust role",
      "origin": "DISCOVERED_AFTER_FEDERATION_V2",
      "portfolio_cluster": "pq-metachain-rnd",
      "repository": "Shtenco/synergy_metachain",
      "role": "Post-quantum metachain, bridge and migration research target",
      "top20_steps": [6,17,20]
    },
    {
      "authority": "RESEARCH_ONLY",
      "classification": "ACTIVE_R&D_SOURCE",
      "maturity": "STRUCTURED_R&D",
      "next_milestone": "Global wavefront compiler V2.4 with measured lane and switch utilization",
      "origin": "DISCOVERED_AFTER_FEDERATION_V2",
      "portfolio_cluster": "compute-hardware-rnd",
      "repository": "Shtenco/motherboard_xpu_xml",
      "role": "XPU/EML hardware-software co-design and wavefront mapping research",
      "top20_steps": [6,16,20]
    },
    {
      "authority": "NONE",
      "classification": "R&D_PLACEHOLDER",
      "maturity": "README_ONLY",
      "next_milestone": "Materialize a falsifiable consolidated-economics model or archive/redirect",
      "origin": "DISCOVERED_AFTER_FEDERATION_V2",
      "portfolio_cluster": "monetary-rnd",
      "repository": "Shtenco/print_money_synergychain",
      "role": "Monetary/tokenomics placeholder governed by the external-profit constitution",
      "top20_steps": [2,6,20]
    }
  ],
  "repository_count": 45,
  "schema": "synergy.repository-federation/v3-candidate"
}
